{
  "$schema": "https://json-schema.org/draft/2020-12/schema",
  "$id": "https://flowops.example/contracts/v1/PaymentSucceeded.schema.json",
  "title": "PaymentSucceeded v1",
  "type": "object",
  "additionalProperties": false,
  "required": [
    "eventId",
    "eventType",
    "eventVersion",
    "aggregateId",
    "correlationId",
    "occurredAt",
    "payload"
  ],
  "properties": {
    "eventId": {
      "type": "string",
      "format": "uuid",
      "pattern": "^[0-9a-fA-F]{8}-[0-9a-fA-F]{4}-[0-9a-fA-F]{4}-[0-9a-fA-F]{4}-[0-9a-fA-F]{12}$"
    },
    "eventType": {
      "const": "PaymentSucceeded"
    },
    "eventVersion": {
      "const": 1
    },
    "aggregateId": {
      "type": "string",
      "format": "uuid",
      "pattern": "^[0-9a-fA-F]{8}-[0-9a-fA-F]{4}-[0-9a-fA-F]{4}-[0-9a-fA-F]{4}-[0-9a-fA-F]{12}$"
    },
    "correlationId": {
      "type": "string",
      "format": "uuid",
      "pattern": "^[0-9a-fA-F]{8}-[0-9a-fA-F]{4}-[0-9a-fA-F]{4}-[0-9a-fA-F]{4}-[0-9a-fA-F]{12}$"
    },
    "occurredAt": {
      "type": "string",
      "format": "date-time"
    },
    "payload": {
      "type": "object",
      "additionalProperties": false,
      "required": [
        "causationId",
        "paymentId"
      ],
      "properties": {
        "causationId": {
          "type": "string",
          "format": "uuid",
          "pattern": "^[0-9a-fA-F]{8}-[0-9a-fA-F]{4}-[0-9a-fA-F]{4}-[0-9a-fA-F]{4}-[0-9a-fA-F]{12}$"
        },
        "paymentId": {
          "type": "string",
          "format": "uuid",
          "pattern": "^[0-9a-fA-F]{8}-[0-9a-fA-F]{4}-[0-9a-fA-F]{4}-[0-9a-fA-F]{4}-[0-9a-fA-F]{12}$"
        }
      }
    }
  }
}
